{
  "$defs": {
    "actor": {
      "additionalProperties": false,
      "properties": {
        "actorId": {
          "minLength": 1,
          "type": "string"
        },
        "actorType": {
          "enum": [
            "human",
            "agent",
            "kernel"
          ]
        }
      },
      "required": [
        "actorType",
        "actorId"
      ],
      "type": "object"
    },
    "exclusionRef": {
      "additionalProperties": false,
      "properties": {
        "$exclusion": {
          "$ref": "#/$defs/id"
        }
      },
      "required": [
        "$exclusion"
      ],
      "type": "object"
    },
    "gapRef": {
      "additionalProperties": false,
      "properties": {
        "$gap": {
          "$ref": "#/$defs/id"
        }
      },
      "required": [
        "$gap"
      ],
      "type": "object"
    },
    "id": {
      "pattern": "^[a-z0-9][a-z0-9._:-]*$",
      "type": "string"
    },
    "provenance": {
      "additionalProperties": false,
      "properties": {
        "extractedAt": {
          "type": "string"
        },
        "extractor": {
          "type": "string"
        },
        "locator": {
          "type": "string"
        },
        "sourceArtifact": {
          "type": "string"
        }
      },
      "required": [
        "sourceArtifact",
        "locator",
        "extractor",
        "extractedAt"
      ],
      "type": "object"
    },
    "timestamp": {
      "pattern": "^\\d{4}-\\d{2}-\\d{2}(T\\d{2}:\\d{2}:\\d{2}(\\.\\d+)?Z)?$",
      "type": "string"
    }
  },
  "$id": "https://docket.offgriddevices.com/schema/Scenario.schema.json",
  "$schema": "https://json-schema.org/draft/2020-12/schema",
  "additionalProperties": false,
  "description": "",
  "properties": {
    "conditions": {
      "items": {
        "type": "string"
      },
      "type": "array"
    },
    "confidence": {
      "enum": [
        "explicit",
        "inferred",
        "absent"
      ]
    },
    "createdAt": {
      "$ref": "#/$defs/timestamp"
    },
    "createdBy": {
      "$ref": "#/$defs/actor"
    },
    "description": {
      "type": "string"
    },
    "id": {
      "$ref": "#/$defs/id"
    },
    "ingestionProvenance": {
      "$ref": "#/$defs/provenance"
    },
    "name": {
      "type": "string"
    },
    "rationale": {
      "oneOf": [
        {
          "type": "string"
        },
        {
          "$ref": "#/$defs/exclusionRef"
        },
        {
          "$ref": "#/$defs/gapRef"
        }
      ]
    },
    "rev": {
      "minimum": 1,
      "type": "integer"
    },
    "source": {
      "oneOf": [
        {
          "$ref": "#/$defs/id"
        },
        {
          "$ref": "#/$defs/exclusionRef"
        },
        {
          "$ref": "#/$defs/gapRef"
        }
      ]
    },
    "supersedes": {
      "$ref": "#/$defs/id"
    },
    "type": {
      "const": "Scenario"
    }
  },
  "required": [
    "id",
    "type",
    "rev",
    "createdBy",
    "createdAt",
    "name",
    "description",
    "rationale",
    "conditions",
    "source"
  ],
  "title": "Scenario",
  "type": "object"
}
